{"approval":{"content_sha256":"affd0f3f99a9f0033667deafc3dce96144500afa76110fc33a93f9d190d62228"},"document_id":"nested_aba","revision":2,"schema_version":"0.1.0","script":{"brief":"\u305f\u3081\u3089\u3044\u306a\u304c\u3089\u4e3b\u984c\u3092\u793a\u3057\u3001\u52d5\u304d\u306e\u3042\u308b\u5bfe\u7167\u90e8\u3092\u7d4c\u3066\u3001\u7e26\u3092\u63c3\u3048\u305f\u4e3b\u984c\u3078\u623b\u308a\u3001\u5341\u5206\u306a\u4f59\u97fb\u3067\u9589\u3058\u308b\u3002","materials":{"cadence":{"description":"\u4e3b\u97f3\u3092\u9577\u304f\u4fdd\u3064\u7d42\u6b62\u7d20\u6750\u3002","kind":"ending"},"connector":{"description":"\u96a3\u306e\u5834\u9762\u3078\u5c0e\u304f\u77ed\u3044\u7d20\u6750\u3002","kind":"transition"},"contrast":{"description":"\u4e3b\u984c\u3068\u7570\u306a\u308b\u52d5\u304d\u3092\u6301\u3064\u7d20\u6750\u3002","kind":"contrast"},"theme":{"description":"\u554f\u3044\u304b\u3051\u308b\u4e2d\u5fc3\u4e3b\u984c\u3002","kind":"theme"}},"performance_setup":{"instrumentation":"solo_piano","performance_directions":{"aligned_return":{"description":"\u5e30\u9084\u90e8\u306f\u5192\u982d\u3088\u308a\u7e26\u3092\u63c3\u3048\u3001\u7c21\u6f54\u306b\u9032\u3081\u308b\u3002","relative_to":{"id":"a1","type":"section"},"target":{"id":"a2","type":"section"}},"contrast_growth":{"description":"\u5bfe\u7167\u90e8\u306e\u5f8c\u534a\u306f\u97f3\u91cf\u3068\u6d41\u308c\u3092\u4e00\u6bb5\u3060\u3051\u9ad8\u3081\u308b\u3002","relative_to":{"id":"b1","type":"section"},"target":{"id":"b2","type":"section"}},"opening_answer":{"description":"\u540c\u3058\u4e3b\u984c\u3092\u4fdd\u3061\u306a\u304c\u3089\u5c11\u3057\u524d\u3078\u9032\u3081\u308b\u3002","relative_to":{"id":"a1_open","type":"section"},"target":{"id":"a1_answer","type":"section"}},"opening_freedom":{"description":"\u5192\u982d\u306f\u547c\u5438\u3068\u6e9c\u3081\u3092\u611f\u3058\u308b\u7a0b\u5ea6\u306b\u6642\u9593\u3092\u63fa\u3089\u3059\u3002","target":{"id":"a1_open","type":"section"}}},"target_duration_seconds":180},"placements":{"a1_answer_theme":{"material_id":"theme","section_id":"a1_answer"},"a1_open_theme":{"material_id":"theme","section_id":"a1_open"},"a2_answer_theme":{"material_id":"theme","section_id":"a2_answer"},"a2_open_theme":{"material_id":"theme","section_id":"a2_open"},"b1_contrast":{"material_id":"contrast","section_id":"b1"},"b2_contrast":{"material_id":"contrast","section_id":"b2"},"bridge_ab_connector":{"material_id":"connector","section_id":"bridge_ab"},"bridge_ba_connector":{"material_id":"connector","section_id":"bridge_ba"},"release_cadence":{"material_id":"cadence","section_id":"release"}},"requirements":{"contrast_end_louder_than_start":{"feature":"loudness","performance_direction_id":"contrast_growth","relation":"more"},"return_more_aligned_than_opening":{"feature":"onset_alignment","performance_direction_id":"aligned_return","relation":"more"}},"root_section_id":"whole","sections":{"a1":{"description":"\u4e3b\u984c\u3092\u4e8c\u3064\u306e\u5c0f\u533a\u5206\u3067\u793a\u3059\u3002","order":0,"parent_section_id":"whole","role":"statement"},"a1_answer":{"description":"\u4e3b\u984c\u3092\u4fdd\u3063\u3066\u5fdc\u7b54\u3059\u308b\u3002","order":1,"parent_section_id":"a1","relative_length":3,"role":"variation"},"a1_open":{"description":"\u4e3b\u984c\u3092\u3086\u3063\u305f\u308a\u63d0\u793a\u3059\u308b\u3002","order":0,"parent_section_id":"a1","relative_length":3,"role":"statement"},"a2":{"description":"\u4e3b\u984c\u3092\u4e8c\u3064\u306e\u5c0f\u533a\u5206\u3067\u56de\u5e30\u3055\u305b\u308b\u3002","order":4,"parent_section_id":"whole","role":"return"},"a2_answer":{"description":"\u4e3b\u984c\u3092\u77ed\u304f\u8a00\u3044\u5207\u308b\u3002","order":1,"parent_section_id":"a2","relative_length":3,"role":"variation"},"a2_open":{"description":"\u4e3b\u984c\u3092\u7e26\u306e\u63c3\u3063\u305f\u5f62\u3067\u623b\u3059\u3002","order":0,"parent_section_id":"a2","relative_length":3,"role":"statement"},"b":{"description":"\u52d5\u304d\u306e\u3042\u308b\u5bfe\u7167\u90e8\u3002","order":2,"parent_section_id":"whole","role":"contrast"},"b1":{"description":"\u65b0\u3057\u3044\u52d5\u304d\u3092\u793a\u3059\u3002","order":0,"parent_section_id":"b","relative_length":3,"role":"contrast"},"b2":{"description":"\u540c\u3058\u52d5\u304d\u3092\u5c11\u3057\u9ad8\u3081\u308b\u3002","order":1,"parent_section_id":"b","relative_length":3,"role":"climax"},"bridge_ab":{"description":"\u5bfe\u7167\u90e8\u3078\u77ed\u304f\u3064\u306a\u3050\u3002","order":1,"parent_section_id":"whole","relative_length":1,"role":"transition"},"bridge_ba":{"description":"\u5e30\u9084\u90e8\u3078\u77ed\u304f\u3064\u306a\u3050\u3002","order":3,"parent_section_id":"whole","relative_length":1,"role":"transition"},"release":{"description":"\u5341\u5206\u306a\u9577\u3055\u306e\u4f59\u97fb\u3067\u9589\u3058\u308b\u3002","order":5,"parent_section_id":"whole","relative_length":2,"role":"release"},"whole":{"description":"A-B-A\u306e\u5168\u4f53\u69cb\u6210\u3002","order":0,"parent_section_id":null,"role":"whole"}},"title":"\u554f\u3044\u3068\u5e30\u9084","transitions":{"a_to_b":{"connector_placement_id":"bridge_ab_connector","description":"\u4e3b\u984c\u306e\u5fdc\u7b54\u304b\u3089\u5bfe\u7167\u7d20\u6750\u3078\u81ea\u7136\u306b\u5c0e\u304f\u3002","from_placement_id":"a1_answer_theme","to_placement_id":"b1_contrast"},"b_to_a":{"connector_placement_id":"bridge_ba_connector","description":"\u5bfe\u7167\u90e8\u306e\u9802\u70b9\u304b\u3089\u4e3b\u984c\u306e\u56de\u5e30\u3078\u843d\u3061\u7740\u304b\u305b\u308b\u3002","from_placement_id":"b2_contrast","to_placement_id":"a2_open_theme"}},"variations":{"a1_answer_variation":{"change":["\u6d41\u308c"],"description":"\u4e00\u56de\u76ee\u306e\u4e3b\u984c\u3092\u5c11\u3057\u524d\u3078\u9032\u3081\u3066\u5fdc\u7b54\u3059\u308b\u3002","preserve":["\u4e3b\u984c\u306e\u8f2a\u90ed"],"source":{"id":"a1_open","type":"section"},"target":{"id":"a1_answer","type":"section"}},"b_growth_variation":{"change":["\u5f37\u3055"],"description":"\u5bfe\u7167\u7d20\u6750\u3092\u4fdd\u3061\u306a\u304c\u3089\u5c11\u3057\u76db\u308a\u4e0a\u3052\u308b\u3002","preserve":["\u5bfe\u7167\u7d20\u6750\u306e\u52d5\u304d"],"source":{"id":"b1","type":"section"},"target":{"id":"b2","type":"section"}},"return_variation":{"change":["\u6253\u9375\u306e\u63c3\u3044\u65b9"],"description":"\u5192\u982d\u306e\u4e3b\u984c\u7fa4\u3092\u7e26\u306e\u63c3\u3063\u305f\u6f14\u594f\u3067\u56de\u5e30\u3055\u305b\u308b\u3002","preserve":["\u4e3b\u984c\u3068\u5c0f\u533a\u5206\u306e\u9806\u5e8f"],"source":{"id":"a1","type":"section"},"target":{"id":"a2","type":"section"}}}},"status":"approved"}
